{
  "version": 1,
  "status": "draft",
  "pack": {
    "file": "03-music.json",
    "title": "Music"
  },
  "questions": [
    {
      "id": "qz-music-q001",
      "question": "Which composer wrote the opera Carmen?",
      "answers": ["Georges Bizet", "Bizet"]
    },
    {
      "id": "qz-music-q002",
      "question": "The Beatles formed in which English city?",
      "answers": ["Liverpool"]
    },
    {
      "id": "qz-music-q003",
      "question": "Which Italian musical direction tells a performer to play softly?",
      "answers": ["piano"]
    },
    {
      "id": "qz-music-q004",
      "question": "Who sang the 2014 hit 'Shake It Off'?",
      "answers": ["Taylor Swift"]
    },
    {
      "id": "qz-music-q005",
      "question": "Which ensemble normally contains two violins, a viola, and a cello?",
      "answers": ["string quartet", "a string quartet"]
    },
    {
      "id": "qz-music-q006",
      "question": "Which artist released the album Blue in 1971?",
      "answers": ["Joni Mitchell", "Mitchell"]
    },
    {
      "id": "qz-music-q007",
      "question": "Which band recorded 'Bohemian Rhapsody'?",
      "answers": ["Queen"]
    },
    {
      "id": "qz-music-q008",
      "question": "What is the name of Elvis Presley's famous Memphis mansion?",
      "answers": ["Graceland"]
    },
    {
      "id": "qz-music-q009",
      "question": "Who sang the 2010 hit 'Rolling in the Deep'?",
      "answers": ["Adele"]
    },
    {
      "id": "qz-music-q010",
      "question": "Which boy band sang 'I Want It That Way'?",
      "answers": ["Backstreet Boys", "The Backstreet Boys"]
    },
    {
      "id": "qz-music-q011",
      "question": "Who was the lead singer of Queen?",
      "answers": ["Freddie Mercury", "Mercury"]
    },
    {
      "id": "qz-music-q012",
      "question": "Who sang the 2010 hit 'Baby' featuring Ludacris?",
      "answers": ["Justin Bieber", "Bieber"]
    },
    {
      "id": "qz-music-q013",
      "question": "The pop group ABBA comes from which country?",
      "answers": ["Sweden", "Swedish"]
    },
    {
      "id": "qz-music-q014",
      "question": "Who sang the 2007 hit 'Umbrella'?",
      "answers": ["Rihanna"]
    },
    {
      "id": "qz-music-q015",
      "question": "In music, what does 'DJ' stand for?",
      "answers": ["Disc jockey", "Disk jockey"]
    },
    {
      "id": "qz-music-q016",
      "question": "Who sang the 2019 hit 'Bad Guy'?",
      "answers": ["Billie Eilish", "Eilish"]
    },
    {
      "id": "qz-music-q017",
      "question": "Which band released 'Hey Jude'?",
      "answers": ["The Beatles", "Beatles"]
    },
    {
      "id": "qz-music-q018",
      "question": "Who sang the 2017 hit 'Shape of You'?",
      "answers": ["Ed Sheeran", "Sheeran"]
    },
    {
      "id": "qz-music-q019",
      "question": "Which K-pop group released 'Dynamite' in 2020?",
      "answers": ["BTS", "Bangtan Boys"]
    },
    {
      "id": "qz-music-q020",
      "question": "Who sang 'Hound Dog' and 'Jailhouse Rock'?",
      "answers": ["Elvis Presley", "Elvis"]
    },
    {
      "id": "qz-music-q021",
      "question": "What is the highest female singing voice called?",
      "answers": ["Soprano"]
    },
    {
      "id": "qz-music-q022",
      "question": "Who sang the 1998 hit '...Baby One More Time'?",
      "answers": ["Britney Spears", "Britney"]
    },
    {
      "id": "qz-music-q023",
      "question": "Which girl group sang the 1996 hit 'Wannabe'?",
      "answers": ["Spice Girls", "The Spice Girls"]
    },
    {
      "id": "qz-music-q024",
      "question": "Which band released 'Smells Like Teen Spirit'?",
      "answers": ["Nirvana"]
    },
    {
      "id": "qz-music-q025",
      "question": "Who was the lead singer of Nirvana?",
      "answers": ["Kurt Cobain", "Cobain"]
    },
    {
      "id": "qz-music-q026",
      "question": "Who sang the hits 'Firework' and 'Roar'?",
      "answers": ["Katy Perry"]
    },
    {
      "id": "qz-music-q027",
      "question": "Which rapper's real name is Marshall Mathers?",
      "answers": ["Eminem", "Slim Shady"]
    },
    {
      "id": "qz-music-q028",
      "question": "Bob Marley is most associated with which genre of music?",
      "answers": ["Reggae"]
    },
    {
      "id": "qz-music-q029",
      "question": "Who sang the 1984 hit 'Purple Rain'?",
      "answers": ["Prince"]
    },
    {
      "id": "qz-music-q030",
      "question": "Who sang 'I Will Always Love You' in the film The Bodyguard?",
      "answers": ["Whitney Houston", "Whitney"]
    },
    {
      "id": "qz-music-q031",
      "question": "Who sang the 2013 hit 'Wrecking Ball'?",
      "answers": ["Miley Cyrus", "Miley"]
    },
    {
      "id": "qz-music-q032",
      "question": "Which band recorded 'Stairway to Heaven'?",
      "answers": ["Led Zeppelin", "Zeppelin"]
    },
    {
      "id": "qz-music-q033",
      "question": "Who sang the 2010 hit 'Just the Way You Are'?",
      "answers": ["Bruno Mars"]
    },
    {
      "id": "qz-music-q034",
      "question": "Who sang the 2019 hit 'Blinding Lights'?",
      "answers": ["The Weeknd", "Weeknd"]
    },
    {
      "id": "qz-music-q035",
      "question": "Who sang the 1972 hit 'Rocket Man'?",
      "answers": ["Elton John"]
    },
    {
      "id": "qz-music-q036",
      "question": "Mick Jagger is the frontman of which band?",
      "answers": ["The Rolling Stones", "Rolling Stones", "Stones"]
    },
    {
      "id": "qz-music-q037",
      "question": "Who sang the 2018 hit 'Thank U, Next'?",
      "answers": ["Ariana Grande", "Ariana"]
    },
    {
      "id": "qz-music-q038",
      "question": "Which rapper released the 2018 hit 'God's Plan'?",
      "answers": ["Drake"]
    },
    {
      "id": "qz-music-q039",
      "question": "Which brass instrument did jazz great Louis Armstrong famously play?",
      "answers": ["Trumpet"]
    },
    {
      "id": "qz-music-q040",
      "question": "Which band recorded 'Sweet Child O' Mine'?",
      "answers": ["Guns N' Roses", "Guns and Roses"]
    },
    {
      "id": "qz-music-q041",
      "question": "Who sang 'My Heart Will Go On', the theme from Titanic?",
      "answers": ["Celine Dion"]
    },
    {
      "id": "qz-music-q042",
      "question": "How many strings does a violin have?",
      "answers": ["4"]
    },
    {
      "id": "qz-music-q043",
      "question": "Which rapper released the 2019 hit 'Old Town Road'?",
      "answers": ["Lil Nas X"]
    },
    {
      "id": "qz-music-q044",
      "question": "Which band recorded 'Hotel California'?",
      "answers": ["Eagles", "The Eagles"]
    },
    {
      "id": "qz-music-q045",
      "question": "Which country music star wrote and sang 'Jolene'?",
      "answers": ["Dolly Parton", "Dolly"]
    },
    {
      "id": "qz-music-q046",
      "question": "Who sang 'Happy' from the film Despicable Me 2?",
      "answers": ["Pharrell Williams", "Pharrell"]
    },
    {
      "id": "qz-music-q047",
      "question": "Who is the lead singer of Coldplay?",
      "answers": ["Chris Martin"]
    },
    {
      "id": "qz-music-q048",
      "question": "Which band released the 1995 hit 'Wonderwall'?",
      "answers": ["Oasis"]
    },
    {
      "id": "qz-music-q049",
      "question": "Who sang the 1963 country hit 'Ring of Fire'?",
      "answers": ["Johnny Cash", "Cash"]
    },
    {
      "id": "qz-music-q050",
      "question": "Which Australian band released 'Back in Black'?",
      "answers": ["AC/DC", "ACDC", "AC DC"]
    },
    {
      "id": "qz-music-q051",
      "question": "Who sang the 1972 hit 'Superstition'?",
      "answers": ["Stevie Wonder"]
    },
    {
      "id": "qz-music-q052",
      "question": "Who sang the 2014 hit 'Chandelier'?",
      "answers": ["Sia"]
    },
    {
      "id": "qz-music-q053",
      "question": "Which instrument is smooth-jazz star Kenny G famous for playing?",
      "answers": ["Saxophone", "Sax", "Soprano saxophone"]
    },
    {
      "id": "qz-music-q054",
      "question": "Which band released 'Livin' on a Prayer'?",
      "answers": ["Bon Jovi"]
    },
    {
      "id": "qz-music-q055",
      "question": "Who sang the 1967 soul anthem 'Respect'?",
      "answers": ["Aretha Franklin", "Aretha"]
    },
    {
      "id": "qz-music-q056",
      "question": "Which band released the 1982 soft-rock hit 'Africa'?",
      "answers": ["Toto"]
    },
    {
      "id": "qz-music-q057",
      "question": "Who sang the 2019 hit 'Watermelon Sugar'?",
      "answers": ["Harry Styles"]
    },
    {
      "id": "qz-music-q058",
      "question": "Harry Styles rose to fame in which boy band?",
      "answers": ["One Direction", "1D"]
    },
    {
      "id": "qz-music-q059",
      "question": "Who sang the 2020 hit 'Levitating'?",
      "answers": ["Dua Lipa"]
    },
    {
      "id": "qz-music-q060",
      "question": "Which Norwegian band released the 1985 hit 'Take On Me'?",
      "answers": ["a-ha", "aha", "A-ha"]
    },
    {
      "id": "qz-music-q061",
      "question": "Who sang the 1983 hit 'Girls Just Want to Have Fun'?",
      "answers": ["Cyndi Lauper"]
    },
    {
      "id": "qz-music-q062",
      "question": "Which band released 'Every Breath You Take'?",
      "answers": ["The Police", "Police"]
    },
    {
      "id": "qz-music-q063",
      "question": "Who is the lead singer of U2?",
      "answers": ["Bono"]
    },
    {
      "id": "qz-music-q064",
      "question": "Who sang the 2009 hit 'Bad Romance'?",
      "answers": ["Lady Gaga", "Gaga"]
    },
    {
      "id": "qz-music-q065",
      "question": "Bagpipes are the national instrument of which country?",
      "answers": ["Scotland"]
    },
    {
      "id": "qz-music-q066",
      "question": "Flamenco music comes from which country?",
      "answers": ["Spain"]
    },
    {
      "id": "qz-music-q067",
      "question": "Mariachi music comes from which country?",
      "answers": ["Mexico"]
    },
    {
      "id": "qz-music-q068",